<?xml version="1.0" encoding="UTF-8" standalone="yes"?>
<managers xmlns:xsi="http://www.w3.org/2001/XMLSchema-instance" xsi:noNamespaceSchemaLocation="managers.xsd">
    <manager>
        <id>1</id>
        <accountNumber>13045653724082753497</accountNumber>
        <username>admin</username>
        <password></password>
        <soldDrones>
            <drone>
                <droneName>AeroFalcon-X1</droneName>
                <batteryCapacity>5200</batteryCapacity>
                <price>1475.2</price>
                <droneNew>true</droneNew>
                <framsShape>X</framsShape>
                <isAutonomus>true</isAutonomus>
            </drone>
            <drone>
                <droneName>SkyNomad-11</droneName>
                <batteryCapacity>6000</batteryCapacity>
                <price>1510.6</price>
                <droneNew>true</droneNew>
                <framsShape>X</framsShape>
                <isAutonomus>true</isAutonomus>
            </drone>
        </soldDrones>
    </manager>
    <manager>
        <id>1</id>
        <accountNumber>17478388203806195170</accountNumber>
        <username>user</username>
        <password></password>
        <soldDrones>
            <drone>
                <droneName>NovaWing-13</droneName>
                <batteryCapacity>5700</batteryCapacity>
                <price>1349.99</price>
                <droneNew>true</droneNew>
                <framsShape>H</framsShape>
                <isAutonomus>true</isAutonomus>
            </drone>
            <drone>
                <droneName>HyperFalcon-98</droneName>
                <batteryCapacity>6900</batteryCapacity>
                <price>2099.0</price>
                <droneNew>true</droneNew>
                <framsShape>X</framsShape>
                <isAutonomus>true</isAutonomus>
            </drone>
            <drone>
                <droneName>QuantumEye-99</droneName>
                <batteryCapacity>7100</batteryCapacity>
                <price>2375.5</price>
                <droneNew>false</droneNew>
                <framsShape>X</framsShape>
                <isAutonomus>false</isAutonomus>
            </drone>
        </soldDrones>
    </manager>
    <manager>
        <id>3</id>
        <accountNumber>8290013299286208802</accountNumber>
        <username>manager</username>
        <password></password>
        <soldDrones>
            <drone>
                <droneName>QuantumEye-99</droneName>
                <batteryCapacity>7100</batteryCapacity>
                <price>2375.5</price>
                <droneNew>false</droneNew>
                <framsShape>X</framsShape>
                <isAutonomus>false</isAutonomus>
            </drone>
            <drone>
                <droneName>AeroFalcon-X1</droneName>
                <batteryCapacity>5200</batteryCapacity>
                <price>1475.2</price>
                <droneNew>true</droneNew>
                <framsShape>X</framsShape>
                <isAutonomus>true</isAutonomus>
            </drone>
            <drone>
                <droneName>AeroFalcon-X1</droneName>
                <batteryCapacity>5200</batteryCapacity>
                <price>1475.2</price>
                <droneNew>true</droneNew>
                <framsShape>X</framsShape>
                <isAutonomus>true</isAutonomus>
            </drone>
            <drone>
                <droneName>StormWing-B3</droneName>
                <batteryCapacity>5800</batteryCapacity>
                <price>1589.99</price>
                <droneNew>true</droneNew>
                <framsShape>H</framsShape>
                <isAutonomus>true</isAutonomus>
            </drone>
            <drone>
                <droneName>PhantomScout-G8</droneName>
                <batteryCapacity>5600</batteryCapacity>
                <price>1250.3</price>
                <droneNew>true</droneNew>
                <framsShape>L</framsShape>
                <isAutonomus>false</isAutonomus>
            </drone>
            <drone>
                <droneName>ThunderEye-H9</droneName>
                <batteryCapacity>6800</batteryCapacity>
                <price>1899.49</price>
                <droneNew>true</droneNew>
                <framsShape>X</framsShape>
                <isAutonomus>true</isAutonomus>
            </drone>
        </soldDrones>
    </manager>
</managers>
