<?xml version="1.0" encoding="UTF-8" standalone="yes"?>
<?xml-stylesheet type="text/xsl" href="managers.xsl"?>
<managers xmlns:xsi="http://www.w3.org/2001/XMLSchema-instance" xsi:noNamespaceSchemaLocation="managers.xsd">
    <manager>
        <id>1</id>
        <accountNumber>627630144951673105</accountNumber>
        <username>admin</username>
        <password>admin</password>
        <soldDrones>
            <drone>
                <droneName>AeroFalcon-X1</droneName>
                <batteryCapacity>5200</batteryCapacity>
                <price>1475.2</price>
                <droneNew>true</droneNew>
                <framsShape>X</framsShape>
                <isAutonomus>true</isAutonomus>
            </drone>
            <drone>
                <droneName>SkyRanger-A3</droneName>
                <batteryCapacity>6100</batteryCapacity>
                <price>1320.5</price>
                <droneNew>true</droneNew>
                <framsShape>O</framsShape>
                <isAutonomus>true</isAutonomus>
            </drone>
            <drone>
                <droneName>NightHawk-D5</droneName>
                <batteryCapacity>6400</batteryCapacity>
                <price>1749.95</price>
                <droneNew>true</droneNew>
                <framsShape>X</framsShape>
                <isAutonomus>true</isAutonomus>
            </drone>
        </soldDrones>
    </manager>
    <manager>
        <id>2</id>
        <accountNumber>14337904413229547998</accountNumber>
        <username>manager</username>
        <password>manager</password>
        <soldDrones>
            <drone>
                <droneName>IronFalcon-C4</droneName>
                <batteryCapacity>7000</batteryCapacity>
                <price>2199.0</price>
                <droneNew>false</droneNew>
                <framsShape>H</framsShape>
                <isAutonomus>false</isAutonomus>
            </drone>
            <drone>
                <droneName>StormWing-B3</droneName>
                <batteryCapacity>5800</batteryCapacity>
                <price>1589.99</price>
                <droneNew>true</droneNew>
                <framsShape>H</framsShape>
                <isAutonomus>true</isAutonomus>
            </drone>
        </soldDrones>
    </manager>
    <manager>
        <id>3</id>
        <accountNumber>7950445090528196086</accountNumber>
        <username>user</username>
        <password>user</password>
        <soldDrones>
            <drone>
                <droneName>SkyNomad-11</droneName>
                <batteryCapacity>6000</batteryCapacity>
                <price>1510.6</price>
                <droneNew>true</droneNew>
                <framsShape>X</framsShape>
                <isAutonomus>true</isAutonomus>
            </drone>
        </soldDrones>
    </manager>
</managers>
